{
  "schemaVersion": 1,
  "registryVersion": "2.0.0",
  "policy": {
    "sharedSourcesAreImmutable": true,
    "projectsUseFrozenLocalCopies": true,
    "brandComponentsRemainSeparate": true,
    "realProjectsRequireApproved": true,
    "candidateUseRequiresLab": true,
    "noImplicitMigration": true
  },
  "patterns": [
    {
      "id": "layered-subject-window",
      "version": "1.0.0",
      "kind": "root-recipe",
      "status": "lab-ready",
      "autoEligible": false,
      "intensity": "hero",
      "maxPerReel": 1,
      "requiresSourceGate": [
        "single foreground speaker",
        "stable crop during the effect window",
        "alpha capability check",
        "temporal edge review"
      ],
      "fallback": "Place the hero in front of, beside, or around the speaker without changing captions.",
      "packagePath": "video-production/patterns/maria-v2/layered-subject-window/1.0.0"
    },
    {
      "id": "strike-replace",
      "version": "1.0.0",
      "kind": "snippet",
      "status": "approved",
      "autoEligible": true,
      "intensity": "high",
      "maxPerReel": 1,
      "requiresSourceGate": ["spoken contrast or correction"],
      "fallback": "Use a static two-state comparison in a compact panel.",
      "packagePath": "video-production/patterns/maria-v2/strike-replace/1.0.0"
    },
    {
      "id": "semantic-morph",
      "version": "1.0.0",
      "kind": "snippet",
      "status": "lab-ready",
      "autoEligible": false,
      "intensity": "high",
      "maxPerReel": 1,
      "requiresSourceGate": ["the spoken meaning explicitly transforms from one concept to another"],
      "fallback": "Use strike-replace or a static before/after label.",
      "packagePath": "video-production/patterns/maria-v2/semantic-morph/1.0.0"
    },
    {
      "id": "accent-underline",
      "version": "1.0.0",
      "kind": "snippet",
      "status": "approved",
      "autoEligible": true,
      "intensity": "low",
      "maxPerReel": 2,
      "requiresSourceGate": ["one short hero word or label outside the literal caption layer"],
      "fallback": "Keep the word static with restrained blue or Merlot emphasis.",
      "packagePath": "video-production/patterns/maria-v2/accent-underline/1.0.0"
    },
    {
      "id": "animated-counter",
      "version": "1.0.0",
      "kind": "component",
      "status": "approved",
      "autoEligible": true,
      "intensity": "medium",
      "maxPerReel": 1,
      "requiresSourceGate": ["verified numeric value", "recorded factual source"],
      "fallback": "Show the verified value statically.",
      "packagePath": "video-production/patterns/maria-v2/animated-counter/1.0.0"
    },
    {
      "id": "continuous-dashboard",
      "version": "1.0.0",
      "kind": "scene-blueprint",
      "status": "lab-ready",
      "autoEligible": false,
      "intensity": "high",
      "maxPerReel": 1,
      "requiresSourceGate": ["at least two connected verified states or metrics"],
      "fallback": "Use one full-screen comparison or two concise supports.",
      "packagePath": "video-production/patterns/maria-v2/continuous-dashboard/1.0.0"
    },
    {
      "id": "localized-scrim",
      "version": "1.0.0",
      "kind": "readability-primitive",
      "status": "approved",
      "autoEligible": true,
      "intensity": "low",
      "maxPerReel": 8,
      "requiresSourceGate": ["text over detailed media without measured 4.5:1 contrast"],
      "fallback": "Use a local 65-85 percent solid or semitransparent plate.",
      "packagePath": "video-production/patterns/maria-v2/localized-scrim/1.0.0"
    },
    {
      "id": "feed-flood",
      "version": "0.1.0",
      "kind": "scene-blueprint",
      "status": "deferred",
      "autoEligible": false,
      "intensity": "hero",
      "maxPerReel": 0,
      "requiresSourceGate": ["real Maria use case and isolated lab approval"],
      "fallback": "Use a single contextual full-screen capture.",
      "packagePath": ""
    },
    {
      "id": "full-body-matte",
      "version": "0.1.0",
      "kind": "root-recipe",
      "status": "deferred",
      "autoEligible": false,
      "intensity": "hero",
      "maxPerReel": 0,
      "requiresSourceGate": ["multiple justified layered beats and full temporal QA"],
      "fallback": "Use one windowed matte or conventional foreground layout.",
      "packagePath": ""
    }
  ]
}
